{
  "schemaVersion": "helper.extension.manifest/v1",
  "id": "brave-search",
  "displayName": "Brave Search MCP",
  "category": "external",
  "providerType": "mcp",
  "transport": "stdio",
  "description": "Disabled sample external provider for web search.",
  "command": "npx",
  "args": ["-y", "@modelcontextprotocol/server-brave-search"],
  "requiredEnv": ["BRAVE_API_KEY"],
  "capabilities": ["web-search"],
  "trustLevel": "trusted_external",
  "defaultEnabled": false,
  "disabledInCertificationMode": true,
  "quietWhenUnavailable": true,
  "toolPolicy": {
    "allowAllTools": true
  }
}
