{
  "schemaVersion": "helper.extension.manifest/v1",
  "id": "helper-local-tools",
  "displayName": "Helper Local Tools",
  "category": "built_in",
  "providerType": "local_tools",
  "transport": "none",
  "description": "Built-in local tools exposed by Helper.",
  "declaredTools": ["dotnet_test", "read_file", "write_file"],
  "capabilities": ["filesystem", "process-execution"],
  "trustLevel": "built_in",
  "defaultEnabled": true,
  "disabledInCertificationMode": false,
  "quietWhenUnavailable": false
}
